{
  "user_data_model_version": "1.0",
  "payload_schema_version": 1,
  "record_type": "template_library",
  "id": "30000000-0000-4000-8000-000000000013",
  "workspace_id": "20000000-0000-4000-8000-000000000001",
  "payload": {
    "source_store_version": 1,
    "template_ids": [
      "30000000-0000-4000-8000-000000000009"
    ],
    "default_week_id": "30000000-0000-4000-8000-000000000009",
    "bundled_routine_revision": 5
  }
}
